{
  "schema_version": "jules-controller.result.v1",
  "plan_id": "plan-read-only-example",
  "status": "partial",
  "exit_code": 5,
  "action_results": [
    {
      "action_id": "act-inventory",
      "op": "inventory.collect",
      "status": "partial",
      "exit_code": 5,
      "error_code": "partial_coverage",
      "coverage": {
        "complete": false,
        "snapshot_atomic": false,
        "pages": 1,
        "items": 100,
        "skipped_scope": [
          "sessions/overflow"
        ],
        "reasons": [
          "page_budget_exhausted"
        ],
        "resume_ref": "resume-tok-001"
      },
      "data": {
        "scanned": 100
      }
    }
  ],
  "coverage": {
    "complete": false,
    "snapshot_atomic": false,
    "pages": 1,
    "items": 100,
    "skipped_scope": [
      "sessions/overflow"
    ],
    "reasons": [
      "page_budget_exhausted"
    ],
    "resume_ref": "resume-tok-001"
  },
  "omitted_attention_items": [
    "sessions/overflow-item-1"
  ],
  "resume_ref": "resume-tok-001",
  "output_bytes": 741
}
